ID,Language_ID,Primary_Text,Analyzed_Word,Gloss,Translated_Text,Meta_Language_ID,Comment,Part_Of_Speech,Source,Media_ID,Discont_NP,Syntactic_Role
derbyshire-1965-p-064-the-wives-of-mawarye-and-woxka-119,hix,"Wosï yanïmye, kanye mokï nexeye=heno.",wosï	y-anïm-ye	ka-nye	mokï	n-exe-ye	heno,woman	Rel-lift-DPst1	say-A	3AnRm	3Sa-Cop-DPst1	Dead,"He lifted the women, he, the deceased was the one, the one who said it.",,interesting position of heno,N	Vt	N	DPro	Va	Ptc	…,derbyshire1965textos[64],,n,
derbyshire-1965-p-064-the-wives-of-mawarye-and-woxka-121,hix,"Mosonï=ha Woxka, khetxe.",mosonï	ha	Woxka	k-he-txe,3AnPx	Intens	Woxka	1+2-wife-Pos,"'These, Woxka, (are) our wives.",,afterthought,DPro	Ptc	N	N	…,derbyshire1965textos[64],,n,
derbyshire-1965-p-066-the-wives-of-mawarye-and-woxka-162,hix,"Honyetko=tï nehxakonï=ha, yawonye, atxkenyhaha=xak=mak=hatï.",honyetko	tï	n-eh-xakonï	ha	y-awo-nye	atxkenyhaha	xak	mak	hatï,fish.sp	Hrsy	3Sa-Cop-DPst2	Intens	Rel-Iness-Col	small.thing	Misfrtn	Advers	Hrsy,"The ""honyetko"" was inside them, having become a very small thing.",,The *y-* on *y-awo-nye* is unexplained,N	Ptc	Va	Ptc	Pp	N	Ptc	Ptc	Ptc	…,derbyshire1965textos[66],,n,
derbyshire-1965-p-067-the-wives-of-mawarye-and-woxka-196,hix,"Ta... Woxka=y, kekonï=hatï, ïwya=ha, towtï wya.",ta	Woxka	y	0-ke-konï	hatï	ï-wya	ha	t-owtï	wya,Top.Chg	Woxka	Voc	3Sa-say-DPst2	Hrsy	3-Dat	Intens	3R-sm.sx.sblg	Dat,"Marking change of subject, ""Woxka,"" he said to him, to his brother.",,elaboration pattern,Ptc	N	Ptc	Va	Ptc	Pp	Ptc	N	Pp	…,derbyshire1965textos[67],,n,
derbyshire-1965-p-067-the-wives-of-mawarye-and-woxka-197,hix,"Woxka=y, mosonï=ha, ohetxe, kekonï=hatï.",Woxka	y	mosonï	ha	o-he-txe	0-ke-konï	hatï,Woxka	Voc	3AnPx	Intens	2-wife-Pos	3Sa-say-DPst2	Hrsy,"""Woxka, this one (is) your wife,"" he said.",,afterthought,N	Ptc	DPro	Ptc	N	Va	Ptc	…,derbyshire1965textos[67],,n,
derbyshire-1965-p-067-the-wives-of-mawarye-and-woxka-201,hix,"Ïto=tï nahxakonï=hatï, ehnï=yohoye, kuthonï=ymo=yohoye=hatï.",ïto	tï	n-ah-xakonï	hatï	ehnï	y-ohoye	kuthonï	ymo	y-ohoye	hatï,there	Hrsy	3AO-sex-DPst2	Hrsy	river	Rel-beside	lake	Augm	Rel-beside	Hrsy,"He was sexually intercoursing her there, beside the river, beside the big lake.",,good example of [[N Ptc] Pp],A	Ptc	Vt	Ptc	N	Pp	N	Ptc	Pp	Ptc	…,derbyshire1965textos[67],,n,
derbyshire-1965-p-067-the-wives-of-mawarye-and-woxka-209,hix,"Woxka=heno yarïye=ha, okoymo=ha.",Woxka	heno	y-arï-ye	ha	okoymo	ha,Woxka	Dead	Rel-take-DPst1	Intens	anaconda	Intens,The anaconda took Woxka away.,,good example of [[N Ptc] Vt],N	Ptc	Vt	Ptc	N	Ptc	…,derbyshire1965textos[67],,n,
derbyshire-1965-p-069-the-wives-of-mawarye-and-woxka-253,hix,"Atxke naha kekonï=hatï, Mawarye=wya, Woxka.",atxke	n-a-ha	0-ke-konï	hatï	mawarye	wya	Woxka,bad	3Sa-Cop-Pres:Cty	3Sa-say-DPst2	Hrsy	Mawarye	Dat	Woxka,"""She is no good,"" said Woxka to Mawarye.",,afterthought,A	Va	Va	Ptc	N	Pp	N	…,derbyshire1965textos[69],,n,
derbyshire-1965-p-023-the-origin-of-the-moon-004,hix,Tïnotxhïrï=rma=hoko nehxakonï.,tï-notxhï-rï	rma	hoko	n-eh-xakonï,3R-sister-Pos	Cont	about	3Sa-Cop-DPst2,He was occupied with his sister.,,Example of *rma* within phrase.,N	Ptc	Pp	Va	…,derbyshire1965textos[23],,n,
ae-personal-narrative-015,aka,mörö winnö urö sang ye'pï meriam ye'pï,mörö	winö	urö	sang	yebï-'pï	Mariam	yebï-'pï,that	from	1Sg	mother	come-Past	Mariam	come-Past,This is where my mother Mariam came from,,afterthought is a whole clause,Dem	P	Pro	N	Vi	N	Vi,caesarDBakawaio,,n,
ae-personal-narrative-018,aka,"i'tuya bogeng bra ji, Akawaio be rï'kwö rö na'kö ji a'ai pïze urö sang nok ne'tai",i'tu-u-ya	bogeng	bra	eji	Akawaio	pe	rï'kwö	rö	na'kö	ji	a'ai	pïze	urö	sang	nok	n-eji-dai,know-1-Erg	like.manner	Neg	be	Akawaio	like	Dim	Emph	maybe	Emph	mother	this.Anim	1Sg	mother	grandmother	3S-be-Past,"I do not know, but my mother's grandmother was Akawaio",,*pïze [urö sang nok]*,Vt	P	Adv	Vi	N	P	Pro	Prtcl	Adv	Prtcl	N	Pro	Pro	N	N	Prs-V-TAM	…,caesarDBakawaio,,np,
ae-personal-narrative-031,aka,mörö kasa tïgo'mangzang nya serö waramadang bo,mörö	kaza	t-ko'mamï-zang	nya	serö	waramadang	po,that	like	Adv-live-Pl.Nzr	1+3	this	Waramadong	Loc,That's how we all live here at Waramadong,,,Dem	P	N	Pro	Pro	N	P,caesarDBakawaio,,np,
cc-praising-rhymes-6,aka,mörö gaza rï'kwö warawok mïre aburöuya mörö,mörö	kaza	rï'kwö	warawok	mïre	aburö-u-ya	mörö,that	like	Dim	boy	child	praise-1-Erg	A.I.?,This is how I would praise a boy child when he is small,,,Dem	P	Pro	N	N	Vt	?,caesarDBakawaio,,np,
cc-praising-rhymes-25,aka,korwak rï'kwö boganing dauya,korwak	rï'kwö	poga-ning	ta-u-ya,patwa.fish	Dim	shoot-A.Nzr	say-1-Erg,"the shhoter of cute little patwa fish, I say",,Good example of [[N Ptc] N],N	Pro	N	Vt	…,caesarDBakawaio,,n,
cc-praising-rhymes-32,aka,sama'nong dauya ganang mörö uri'chang bök,sama'nong	ta-u-ya	kanang	mörö	uri'chang	pök,pretty	say-1-Erg	again	Fut	female	to,"You are pretty, I would say again to the girl",,is mörö really a particle expressing future?,N	Vt	Pro	Prtcl	N	P,caesarDBakawaio,,np,
ae-personal-narrative-033,aka,serö nong bo,serö	nong	po,this	earth	on,on this earth,,,Pro	N	P	…,caesarDBakawaio,,np,
ae-personal-narrative-064,aka,nya ya rö se ji kashiri konega,nya	ya	rö	serö	ji	kajiri	konega,1+3	Erg	Emph	this	Emph	cassava.beer	make,We make this thing called kashiri,,*serö ji kashiri*,Pro	P	Prtcl	Pro	Prtcl	N	Vt	…,caesarDBakawaio,,part,
claudine-bagot-personal-narrative-021,aka,"mörö gaza bek, nai gaza önïk röji enau",mörö	gaza	bek	nai	gaza	önïk	rö-ji	enau,that	like	QP	what	like	who	Emph-Emph	in.hand,"Is this how it will be? How, in whose hands?",,Good example of [[N Ptc Ptc] N],Dem	P	Prtcl	N	P	Pro	Prtcl	P,caesarDBakawaio,,n,
claudine-bagot-personal-narrative-034,aka,mörau ji mörö maing nö na'nek,mörau	ji	mörö	maing	nö	nai-nek,there	Emph	that	word	Emph	3.be.Pres-Rel,There is always speech that is there,,,Adv	Prtcl	Dem	N	Prtcl	Vi-Rel,caesarDBakawaio,,np,
claudine-bagot-personal-narrative-052,aka,kïrörö kïrö magoi se gaza rö mo'kaning dawong,kïrö-rö	kïrö	magoi	zerö	kaza	rö	mo'ka-ning	ta-wong,3Sg.Anim-Cop?	3Sg.Anim	sin	this	like	Emph	take.away-A.Nzr	say-Nzr/Rel?,"It is only the sinful one (evil/satan)who can take you away suddenly, they say",,,Dem	Pro	N	Pro	P	Prtcl	N	N	…,caesarDBakawaio,,np,
claudine-bagot-personal-narrative-087,aka,e'nongga rï'kwörö mörö yeburudong ya rö yereudanïgï a'tai e'nongga tawong ning,e'nongga	rï'kwö-rö	mörö	y-eburu-dong	ya	rö	y-ereuda-nïgï	a'tai	e'nongga	ta-wong	ning,leave	Dim-Emph	that	1-boss-Pl	Erg	Emph	1-sit-Caus	when	leave	say-Nzr/Rel?	Emph,She has said I will leave when my bosses stop me,,,Vi	Adv?-Prtcl	Dem	N	P	Prtcl	Prs-Vi-VDer	Prtcl	Vi	N	Prtcl,caesarDBakawaio,,np,
lester-eugene-personal-narrative-021,aka,mörö dïbo urö ji laspang e'tane ji aigobe rï'kwö e'tane urö gïibïnï ji ma'ta'pï mörö,mörö	tïbo	urö	ji	laspang	e'tane	ji	aigo-be	rï'kwö	eji-dane	urö	kïibïnï	ji	ma'ta-'pï	mörö,that	after	1Sg	Emph	last.one	but	Emph	small-Attr	Dim	be-while	1Sg	father	Emph	die-Past	A.I.?,"Then after that, I am the last one but while I was still small my father died",,confused by the addressee involvement here,Dem	Adv	Pro	Prtcl	N	Prtcl	Prtcl	A	Pro	Vi	Pro	N	Prtcl	Vi	?	…,caesarDBakawaio,,n,
lester-eugene-personal-narrative-026,aka,"kïrörö ji urö gïibïnï ji es'pï mörö kayuni, kayunirïgok nïgabö'tai tok ko",kïrö-rö	ji	urö	kïibïnï	ji	eji-'pï	mörö	kayuni	kayuni-gok	n-ka-bödï-dai	tok	ko,3Sg.Anim-Emph	Emph	1Sg	father	Emph	be-Past	A.I.?	Kuyuni	Kuyuni-tribe	3S-say-Hab-Past	3Pl	Emph," He my father was from a tribe from Kayuni, so they always say",,[*kïrörö ji*] [*urö kïibïnï ji*],Pro	Prtcl	Pro	N	Prtcl	Vi	?	N	N	Vi	Pro	Prtcl	…,caesarDBakawaio,,part,
lester-eugene-personal-narrative-036,aka,dadi bogong nö agïibïnïdong rö tombadong be rö,dadi	pök-ng	nö	a-kïibïnï-dong	rö	tomba-dong	pe	rö,Daddy	about-Nzr	Emph	2-father-Pl	Emph	relative-Pl	like	Emph,also the relative of Daddie your father,,'Daddie your father'?,N	N	Prtcl	N	Prtcl	N	P	Prtcl	…,caesarDBakawaio,,?,
lester-eugene-personal-narrative-047,aka,turonnö mïre bra yesh'pï,turonnö	mïre	bra	y-eji-'pï,another	child	Neg	3-be-Past,there was no other child,,,N	N	Adv	Vi	…,caesarDBakawaio,,np,
lester-eugene-personal-narrative-096,aka,"uri'chang amök, ezugeng uri'chang amök seven gaijarö",uri'chang	amök	ezugeng	uri'chang	amök	gaijarö,female	Pl	of.one.kind	female	Pl	in.number,"with seven girls, all of the same sex",,ADV + N + PL,N	Prtcl	Adv	N	Prtcl	Adv	…,caesarDBakawaio,,np,
lester-eugene-personal-narrative-100,aka,serö ji munggamök a ji urö nïmbödï'pï ji,serö	ji	munggö	amök	ya	ji	urö	nïmï-bödï-'pï	ji,this	Emph	children	Pl	Erg	Emph	1Sg	leave-Pl.Abs-Past	Emph,"Now at this time, my children have now left me",,*serö ji* 'now',Pro	Prtcl	N	Prtcl	P	Prtcl	Pro	Vt	Prtcl	…,caesarDBakawaio,,n,
lester-eugene-personal-narrative-106,aka,uri'chang amök rögeng sa'ne ezugeng warawok amök pra rö,uri'chang	amök	rögeng	sa'ne	ezugeng	warawok	amök	bra	rö,female	Pl	only	Emph	of.one.kind	boy	Pl	Neg	Emph,These are really all girls without any boys,,,N	Prtcl	Prtcl	Prtcl	Adv	N	Prtcl	Adv	Prtcl	…,caesarDBakawaio,,np,
pingkas-personal-narrative-011,aka,wayara yeng diezek ka'tau,wayara	eng	i-ezek	ka'tau,macaw	cave	3-name	high,at a high place named Wayara yeng (Macaw's cave),,"lit. 'its name is wayara yeng, in the sky’",N	N	N	Adv	…,caesarDBakawaio,,n,
pingkas-personal-narrative-022,aka,mörö wenong urö dauwa ning ji,mörö	winö-ng	urö	ta-u-wa	ning	eji,that	from-Nzr	1Sg	say-1-Erg	Emph	be,I am saying that I am from there,,,Dem	N	Pro	Vt	Prtcl	Vi	…,caesarDBakawaio,,np,
pingkas-personal-narrative-031,aka,"mörau sa'ji urö enshi mang ko, mö tong bo",mörau	sa'ji	urö	enji	mang	ko	mörö	tong	po,there	Emph	1Sg	daughter	3.be.Pres	Emph	that	town	Loc,There is my daughter who is in town (meaning Georgetown),,,Adv	Prtcl	Pro	N	Vi	Prtcl	Dem	N	P	…,caesarDBakawaio,,np,
pingkas-personal-narrative-037-pingkas-smith,aka,"mainarï rï'kwörö, mö mainarï möng wïk pïragong bo mainarï mang",maina-ri	rï'kwö-rö	mörö	maina-ri	mörö-ng	wïk	pïragong	po	maina-ri	mang,farm-Psd	Dim-Emph	that	farm-Psd	that-Style	mountain	ankle	Loc	farm-Psd	3.be.Pres,"I do have a fram, there is my farm, over there!!! My farm is at the foot of the mountain",,,N	Adv?-Prtcl	Dem	N	Dem-?	N	N	P	N	Vi	…,caesarDBakawaio,,np,
pingkas-personal-narrative-047,aka,mïgï tok kïipïnïdong winnö mörö ji am..,mïgï	tok	kïibïnï-dong	winö	mörö	ji	am,Hes	3Pl	father-Pl	from	that	Emph	um,From their father's side that,,disfluency,Prtcl	Pro	N	P	Dem	Prtcl	Prtcl	…,caesarDBakawaio,,n,
pingkas-personal-narrative-057,aka,serö rï'kwö rö maing sauro'nö na'nek eji wagïbe rö,serö	rï'kwö	rö	maing	saurogï-nnö	nai-nek	eji	wagï	pe	rö,this	Dim	Emph	word	talk-1+2S	3.be.Pres-Rel	be	good	like	Emph,This language that we talk here is really good,,*serö rï'kwö rö maing* is the argument of 'talk',Pro	Pro	Prtcl	N	Vi	Vi-Rel	Vi	N	P	Prtcl	…,caesarDBakawaio,,np_arg,
pingkas-personal-narrative-064,aka,tu'ke rö tok maimu eji brazil bo kuru,tu'ke	rö	tok	maimu	eji	brazil	po	kuru,many	Emph	3Pl	language	be	Brazil	Loc	Emph,There have several languages in Brazil in particular,,*tu'ke rö tok maimu*,Prtcl	Prtcl	Pro	N	Vi	N	P	Prtcl	…,caesarDBakawaio,,part,
pingkas-personal-narrative-066,aka,"serö ning shi Gaiyana bo rï'kwö ning ji mïgï mörö dö wagïbe kuning maing eji, mörö gaza",serö	ning	ji	Gaiyana	po	rï'kwö	ning	ji	mïgï	mörö	tö	wagï	pe	kuru	ning	maing	eji	mörö	kaza,this	Emph	Emph	Guyana	Loc	Dim	Emph	Emph	Hes	that	go	good	like	Emph	Emph	word	be	that	like,"Here in Guyana the language (Akawaio) goes well (meaning spoken well), like that",,"Probably missing intonational break, *maing eji* is separate from first predicate around *tö*",Pro	Prtcl	Prtcl	N	P	Pro	Prtcl	Prtcl	Prtcl	Dem	Vi	N	P	Prtcl	Prtcl	N	Vi	Dem	P	…,caesarDBakawaio,,n,
pingkas-personal-narrative-068-interviewer,aka,pandong rö penarokrï'pï?,pandong	rö	penarok-rï'pï,story	Emph	old-Past.Psn,Even one that use to be an old story,,,N	Prtcl	N	…,caesarDBakawaio,,part,
ps-duck-story-007,aka,wagïdong rö airö stori amök bu'töga'nïgï tok a be mang,wagï-dong	rö	airö	stori	amök	pu'tögabï-nïgï	tok	ya	pe	mang,good-Pl	Emph	sympathy	story	Pl	forget-Caus	3Pl	Erg	like	3.be.Pres,It seems that they will be forgetting good stories,,[*wagïdong rö airö*] [*stori amök*],N	Prtcl	Prtcl	N	Prtcl	Vi-VDer	Pro	P	P	Vi	…,caesarDBakawaio,,part,
ps-duck-story-012,aka,mai'kwak kïrö mai'kwak tuna gawong,mai'kwak	kïrö	mai'kwak	tuna	ka-wong,duck	3Sg.Anim	duck	water	say-Nzr/Rel?,"The duck, the one that is in the water",,,N	Pro	N	N	N	…,caesarDBakawaio,,np,
ps-duck-story-021,aka,kïrö togodogo ya ji tïmainarï agïdï,kïrö	togodogo	ya	ji	t-maina-ri	agïdï,3Sg.Anim	owl	Erg	Emph	3.Rfl-farm-PS	d	cut,The owl cut his farm,,,Pro	N	P	Prtcl	N	Vt	…,caesarDBakawaio,,np,
ps-duck-story-024,aka,ösöbe kïrö mai'kwak eshi ösöbe shiyampiyan be shi ösö be ji,özö-be	kïrö	mai'kwak	eji	özö-be	shiyampiyan	pe	y-eji	özö	pe	y-eji,serious-Attr	3Sg.Anim	duck	be	serious-Attr	champion	like	3-be	serious	like	3-be,"The duck was a very serious one, he was a serious champion",,,A	Pro	N	Vi	A	N	P	Vi	N	P	Vi	…,caesarDBakawaio,,np,
ps-duck-story-025,aka,kïrö togodogo endai,kïrö	togodogo	endai,3Sg.Anim	owl	better,Better than the owl,,potentially a DEM + N NP,Pro	N	P	…,caesarDBakawaio,,n,
ps-duck-story-026,aka,"togodogo engurumïng... seau, tigingnö yöi ennogöiya",togodogo	engurumï-ng	serau	tiginnö	yöi	ennogï-i-ya,owl	wait-Style	here	one	tree	send-3-Erg,"The owl wold just sit here, then he cut down one tree",,,N	Vi-?	Adv	Prtcl	N	Vt	…,caesarDBakawaio,,np,
ps-duck-story-032,aka,kïrö ning mai'kwak eji mörö ösöbe shiyampiyan be ning shi shenubasak be yeshi,kïrö	ning	mai'kwak	eji	mörö	özö-be	shiyampiyan	pe	ning	y-eji	i-zenuba-zak	pe	y-eji,3Sg.Anim	Emph	duck	be	A.I.?	serious-Attr	champion	like	Emph	3-be	3-learn-Perf	like	3-be,"But the duck is really a very serious one, he is a champion because he is one that is trained",,*kïrö ning mai'kwak*,Pro	Prtcl	N	Vi	?	A	N	P	Prtcl	Vi	Vi	P	Vi	…,caesarDBakawaio,,part,
ps-duck-story-034,aka,a.. a.. pïse tok ewo'pï nosamishi pada bong ning ji tok ewo'pï,a	a	pïze	tok	ewo'pï	nosami'chi	pada	po-ng	ning	ji	tok	ewo'pï,ah	ah	this.Anim	3Pl	mother.in.law	old	place	Loc-Nzr	Emph	Emph	3Pl	mother.in.law,"Then here is their mother-in-law an old woman who was at home, their mother-in-law",,,Prtcl	Prtcl	Pro	Pro	N	N	N	N	Prtcl	Prtcl	Pro	N	…,caesarDBakawaio,,np,
ps-duck-story-039,aka,möra'tai ji mai'kwak dundagabï kïrö togodogo rawörö,möra'tai	ji	mai'kwak	tunda-gabï	kïrö	togodogo	rawörö,at.that.time	Emph	duck	travel-Cmpltv	3Sg.Anim	owl	before,Then the duck would journey back before the owl,,,Pro	Prtcl	N	Vi	Pro	N	P	…,caesarDBakawaio,,np,
ps-duck-story-043,aka,kïrö no'sangshi ya,kïrö	no'sami'chi	ya,3Sg.Anim	old	Erg,By she the old woman,,,Pro	N	P	…,caesarDBakawaio,,np,
ps-duck-story-047,aka,kïrö ji togodogo pada go'manï'ning ingurungnöbök ning te'seng,kïrö	ji	togodogo	pada	ko'manïgï-ning	ingurumï-nöbök	ning	t-eji-zeng,3Sg.Anim	Emph	owl	place	keep-A.Nzr	stay.still-Prog	Emph	Adv-be-Abs.Nzr,Then that owl the one who spent his time resting,,*kïrö ji togodogo*,Pro	Prtcl	N	N	N	Vi	Prtcl	N	…,caesarDBakawaio,,part,
ps-duck-story-055,aka,mai'kwak amök mainarï,mai'kwak	amök	maina-ri,duck	Pl	farm-PS	d,The farm of the ducks,,nice example of possessive construction with intervening particle,N	Prtcl	N	…,caesarDBakawaio,,n,
ps-duck-story-058,aka,"e'tane shi turonggong a, turonggong a shi mïgï mörö mai'kwak mainarï ene'pï",e'tane	ji	turonnö-gong	ya	turonnö-gong	ya	ji	mïgï	mörö	mai'kwak	maina-ri	ene-'pï,so	Emph	another-Pl	Erg	another-Pl	Erg	Emph	Hes	that	duck	farm-PS	d	see-Past,"Then other people, the other people saw the duck's farm",,,Prtcl	Prtcl	N	P	N	P	Prtcl	Prtcl	Dem	N	N	Vi	…,caesarDBakawaio,,np,
ps-duck-story-060,aka,ekepe rö a'naik e'kwa ning ti'tuik pra rö,ege-be	rö	a'naik	e'kwa	ning	t-i'tu-ik	bra	rö,big-Attr	Emph	corn	field	Emph	Adv-know-Prtcpl	Neg	Emph,There were a huge amount of fields with corn and many other crops,,adverb,A	Prtcl	N	N	Prtcl	?-Vt-Vder	Adv	Prtcl	…,caesarDBakawaio,,n,
ps-duck-story-061,aka,a.. kïrö ning mïgï mörö mai'kwak manengbazai'ya mörö,a	kïrö	ning	mïgï	mörö	mai'kwak	manengba-zak-i-ya	mörö,ah	3Sg.Anim	Emph	Hes	that	duck	make.angry-Perf-3-Erg	A.I.?,She had already made the duck angry,,,Prtcl	Pro	Prtcl	Prtcl	Dem	N	Vt	?	…,caesarDBakawaio,,np,
ps-duck-story-064,aka,anembai ta'pï shi pïze tok ewo'pï nosamishi ya mörö,an-ene-bai	ta-'pï	ji	pïze	tok	ewo'pï	no'sami'chi	ya	mörö,3O.Desid-see-Desid	say-Past	Emph	this.Anim	3Pl	mother.in.law	old	Erg	A.I.?,"I want to see it said the old woman, the mother-in-law",,[DEM PL N N] ya?,Adv	Vt	Prtcl	Pro	Pro	N	N	P	?	…,caesarDBakawaio,,n,
ps-duck-story-067,aka,"aikor'kwö wijagong, mïre rï'kwö önïk rönamo uri'shang mïre rï'kwö rö namo",aigo	rï'kwö	wijagong	mïre	rï'kwö	önïk	rönamo	uri'chang	mïre	rï'kwö	rö	namo,small	Dim	other	child	Dim	who	uncrtn	female	child	Dim	Emph	Uncrtnty,"The partner who accompanied her was small, maybe she was a small girl",,*uri'shang mïre*,N	Pro	N	N	Pro	Pro	Prtcl	N	N	Pro	Prtcl	Prtcl	…,caesarDBakawaio,,np,
ps-duck-story-078,aka,möra'tai kïrö no'sanshi döga'pï shi maina ak,möra'tai	kïrö	no'sami'chi	tö-gabï-'pï	ji	maina	yak,at.that.time	3Sg.Anim	old	go-Cmpltv-Past	Emph	farm	into,Then she the old woman went into the farm,,,Pro	Pro	N	Vi	Prtcl	N	P	…,caesarDBakawaio,,np,
ps-duck-story-082,aka,kïrö no'sanshi esh'pï ingge chiya maina ya ji giororo'kasak,kïrö	no'sami'chi	eji-'pï	ingge	chiya	maina	ya	ji	i-kororo'ka-zak,3Sg.Anim	old	be-Past	long.time	far.away	farm	Erg	Emph	3-envelop-Perf,"She the old woman spent a long time there, because the farm had enclosed her",,,Pro	N	Vi	Adv	Pro	N	P	Prtcl	Vt	…,caesarDBakawaio,,np,
ps-duck-story-084,aka,haing! kïrö shi wishagong nöma mörö kasa nöma shi biögörö tiano'maka'pï röma rö,haing	kïrö	ji	ijagong	röma	mörö	kaza	röma	ji	i-pögörö	i-tano'ma-gabï-'pï	röma	rö,sudden.absence	3Sg.Anim	Emph	partner	also	that	like	also	Emph	3-after	3-get.lost-Cmpltv-Past	also	Emph,haing!(expression describing sudden absence)then her partner in a similar manner went after her and also got lost,,*kïrö shi wishagong*,SW	Pro	Prtcl	N	?	Dem	P	?	Prtcl	P	Vi	?	Prtcl	…,caesarDBakawaio,,part,
ps-duck-story-086,aka,"kïrö mai'kwak sagorobasai'ya mörö, iwobiya'masai'ya ning mörö",kïrö	mai'kwak	sagoroba-zak-i-ya	mörö	i-wobiya'ma-zak-i-ya	ning	mörö,3Sg.Anim	duck	make.angry-Perf-3-Erg	A.I.?	3-curse-Perf-3-Erg	Emph	A.I.?,"Now she had made the duck angry, so he had really cursed her with witchcraft",,,Pro	N	Vt	?	Vt	Prtcl	?	…,caesarDBakawaio,,np,
ps-duck-story-087,aka,"a.. weruji be no'sanshi dö mörö, eruwö kïrö rï'kwö ne'pö'ai'nek pe wishagong",a	weruji	pe	no'sami'chi	tö	mörö	eruwö	kïrö	rï'kwö	n-eji-bödï-aik-nek	pe	ijagong,ah	dove	like	old	go	A.I.?	small.dove	3Sg.Anim	Dim	3S-be-Hab-Pres-Rel	like	partner,The old woman turn into a dove and that is how she kept going and her partner went as an eruwö(smaller species of dove) bird,,*eruwö kïrö*,Prtcl	N	P	N	Vi	?	N	Pro	Pro	Prs-Vi-Asp-TAM-Rel	P	N	…,caesarDBakawaio,,np,
r-personal-narrative-014,aka,"tu'ke rö za'ne agarangse'na, tu'kanggong sa'ne mïre ank (amök) rö",tu'ke	rö	sa'ne	a-gwaramï-ze'na	tu'kang-gong	sa'ne	mïre	amök	amök	rö,many	Emph	Emph	A-cry-Purp	several-Pl	Emph	child	Pl	Pl	Emph,"""Many of us to cry,even the many children",,*tu'kanggong sa'ne mïre ank*,Prtcl	Prtcl	Prtcl	??-Vi-VDer	N	Prtcl	N	Prtcl	Prtcl	Prtcl	…,caesarDBakawaio,,part,
r-personal-narrative-022,aka,"wagï genïk so'chi dau eji'ma, e'nek au rö tïwe'kïngmaik tugo'mangzanggong genïk amörö'nogong kabai e'aik",wagï	genïk	jo'chi	tau	eji-i'ma	e'nek	yau	rö	t-e'-kïngma-ik	t-go'mamï-zang-gong	genïk	amörö-'nogong	ga-bai	eji-aik,good	specifically	church	within	be-While	sick	in	Emph	Adv-Detr-hurt-Prtcpl	Adv-live-Pl.Nzr-Pl	Mirative	2Sg-Pl	say-Desid	be-Pres,"Although you are in a good church, all of you seem to live while hurting, I want to say",,,N	Prtcl	N	P	Vi-?	N	P	Prtcl	?-Vi-Vder	N	Prtcl	Pro	Adv	Vi	…,caesarDBakawaio,,part; np_arg,
r-personal-narrative-032,aka,möröbanggong ji winnö wagïrö maing edaze'na yi'sak tugaik eji,möröbang-gong	ji	winö	wagï-rö	maing	eda-ze'na	yebï-zak	t-ka-ik	eji,thereafter-Pl.Abs	Emph	from	good-Emph	word	hear-Purp	come-Perf	Adv-say-Prtcpl	be,So I thought I was coming to hear good words from people like those,,,N	Prtcl	P	N	N	Adv	Vi	?-Vi-Vder	Vi	…,caesarDBakawaio,,np,
r-personal-narrative-042,aka,"e'tane wagï rö kenïk a'ai eji'pï mörau,",e'tane	wagï	rö	kenïk	a'ai	eji-'pï	mörau,however	good	Emph	Purp	mother	be-Past	there,"However, there was one mother who was good",,,Prtcl	N	Prtcl	P?	N	Vi	Adv	…,caesarDBakawaio,,part,
r-personal-narrative-043,aka,paba enau kuru genïk eji'nïnggenak rö kenïk a'ai esh'pï mörau,paba	enau	kuru	genïk	eji'nïng-genak	rö	genïk	a'ai	eji-'pï	mörau,father	in.hand	Emph	Mirative	love-one.who.has	Emph	Mirative	mother	be-Past	there,There was a mother who was loving and in the hands of the 'great father,,*paba enau kuru genïk eji'nïnggenak rö kenïk a'ai* is one large NP,N	P	Prtcl	Prtcl	N	Prtcl	Prtcl	N	Vi	Adv	…,caesarDBakawaio,,part,
r-personal-narrative-064,aka,urö sa'ji zang be nïgubïnï,urö	sa'ji	sang	be	n-gubï-nï,1Sg	Emph	mother	like	O.Nzr-do-Pres.Nzr,The one that I have made my mother,,good example of possessive construction with *sa'ji*,Pro	Prtcl	N	P	N	…,caesarDBakawaio,,n,
ra-eagle-story-001,aka,"mïgï ganang pandong bek i'tuning amö ti'tuik pra rö? tu'ke rï'kwö rö, pandong bek i'tuning amö? wagïdong sa'ne bandomïigong te'seng",mïgï	kanang	pandong	bek	i'tu-ning	amö	t-i'tu-ik	bra	rö	tu'ke	rï'kwö	rö	pandong	bek	i'tu-ning	amö	wagï-dong	sa'ne	pandong-i-gong	t-eji-zeng,this	again	story	QP	know-A.Nzr	2SgQ	Adv-know-Prtcpl	Neg	Emph	many	Dim	Emph	story	QP	know-A.Nzr	2SgQ	good-Pl	Emph	story-Psd-Pl.Psr	Adv-be-Abs.Nzr,"Do you know all types of stories, do you know many stories. We have wonderful stories",,*wagïdon sa'ne bandomïigong*,Pro	Pro	N	Prtcl	N	Pro	?-Vt-Vder	Adv	Prtcl	Prtcl	Pro	Prtcl	N	Prtcl	N	Pro	N	Prtcl	N	N	…,caesarDBakawaio,,part,
ra-eagle-story-008,aka,"möra'tai ji emujimö e'pödï'pï sairö wïk po mörö ömujimö ege, kïrörö",möra'tai	ji	emujimö	eji-bödï-'pï	sairö	wïk	po	mörö	ömujimö	ege	kïrö-rö,at.that.time	Emph	eagle	be-Iter-Past	here	mountain	on	that	eagle	big	3Sg.Anim-Cop?,"At that time there was an eagle here on the mountain, a big eagle that one",,*mörö ömujimö ege*,Pro	Prtcl	N	Vi	Adv	N	P	Dem	N	N	Dem	…,caesarDBakawaio,,np,
ra-eagle-story-018,aka,"eh, eh! ö'rö be ji ji mö tawong ku es'pï mörö möra'tai",eh	eh	ö'rö	pe	ji	y-eji	mörö	ta-wong	kuru	eji-'pï	mörö	möra'tai,yes	yes	what	like	Emph	3-be	that	say-Nzr/Rel?	Emph	be-Past	A.I.?	at.that.time,"There was one who said, what is wrong with him at that time",,,Prtcl	Prtcl	Pro	P	Prtcl	Vi	Dem	N	Prtcl	Vi	?	Pro	…,caesarDBakawaio,,np,
ra-eagle-story-019,aka,mïgï sa'ne ji tok u'ma'kabï kïrö torong ya tok u'madï ya engmingga'pï,mïgï	sa'ne	ji	tok	u'madï-gabï	kïrö	torong	ya	tok	u'madï	ya	engmingga-'pï,this	Emph	Emph	3Pl	deplete-Cmpltv	3Sg.Anim	bird	Erg	3Pl	finish	Erg	make.think-Past,"The numbers of the people were depleting because the bird was finishing them off, this made him think",,,Pro	Prtcl	Prtcl	Pro	Vt	Pro	N	P	Pro	Vt	P	Vt	…,caesarDBakawaio,,np,
ra-eagle-story-022,aka,"diurumï mörö kïrö piyang yebï a'tai kuru, wa'ka durumbödï'pï",i-turumï	mörö	kïrö	piyang	yebï	a'tai	kuru	wa'ka	turumï-bödï-'pï,3-play	A.I.?	3Sg.Anim	hawk	come	when	Emph	axe	play-Iter-Past,"It played especially when the eagle was coming, the axe use to play",,,Vi	?	Pro	N	Vi	Prtcl	Prtcl	N	Vi	…,caesarDBakawaio,,np,
ra-eagle-story-032,aka,höp! dioimabödïiya tamboro mörö wïktong amök yarekadaneiya tutötok i'tuiya bra ji mörau ta tok a,höp	i-toima-bödï-i-ya	tamboro	mörö	wïk-dong	amök	yareka-dane-i-ya	t-tö-dok	i'tu-i-ya	bra	ji	mörau	ta	tok	ya,take.off	3-rotate-Iter-3-Erg	all	that	mountain-Pl	Pl	finish-while-3-Erg	3.Rfl-go-Nzr	know-3-Erg	Neg	Emph	there	say	3Pl	Erg,"höp! He took him round and round all the mountains, but he did not know where he was going then, they say",,,SW	Vt	Adv	Dem	N	Prtcl	Vt	N	Vt	Adv	Prtcl	Adv	Vt	Pro	P	…,caesarDBakawaio,,np,
ra-eagle-story-034,aka,Eneboro'pï se wïk ezek Eneboro'pï,Eneboro'pï	se	wïk	ezek	Eneboro'pï,Eneboro'pï	this	mountain	name	Eneboro'pï,The name of this mountain was Eneboro'pï,,,N	Dem	N	N	N	…,caesarDBakawaio,,np,
ra-eagle-story-037,aka,"möröbang ji wa'ka mïre ji dienau kïrö mïgï köik es'pï mörö, köik shi es'pï",möröbang	ji	wa'ka	mïre	ji	i-enau	kïrö	mïgï	köik	eji-'pï	mörö	köik	ji	eji-'pï,thereafter	Emph	axe	child	Emph	3-in.hand	3Sg.Anim	Hes	old.man	be-Past	A.I.?	old.man	Emph	be-Past,"Then, the old man who was taken away by the eagle was holding on to the axe",,What is going on here?,N	Prtcl	N	N	Prtcl	P	Pro	Prtcl	N	Vi	?	N	Prtcl	Vi	…,caesarDBakawaio,,?,
ra-eagle-story-038,aka,möra'tai ji kïrö ji piyang abö'ka'sai'ya tabiri aranggasakak,möra'tai	ji	kïrö	ji	piyang	abö'kabï-zak-i-ya	t-abiri	arangga-zak-i-ya-k,at.that.time	Emph	3Sg.Anim	Emph	hawk	tire-Perf-3-Erg	3.Rfl-wing	unfold-Perf-3-Erg-Style,"At that time, the tired giant hawk open up his wings",,*kïrö ji piyan*,Pro	Prtcl	Pro	Prtcl	N	Vi	N	Vt-TAM-Prs-Agr-?	…,caesarDBakawaio,,part,
