ID,Language_ID,Primary_Text,Analyzed_Word,Gloss,Translated_Text,Meta_Language_ID,Comment,Part_Of_Speech,Source,Media_ID,Discont_NP,Syntactic_Role
ra-kone-o-story-007,aka,"e'tane, kone'o ezeru ege ne'pö'ang",e'tane	kone'o	ezeru	ege	n-eji-bödï-ang,however	rabbit	ways	big	3S-be-Hab-Pres,"However, there are lots of stories about kone'o",,,Prtcl	N	N	N	Prs-V-Asp-TAM	…,caesarDBakawaio,,np,
ra-kone-o-story-008,aka,kone'o a mïgï mörö kabïi u'ma'sak a'tai ja'neng ingbö i'mozak gaza te'seng mö go,kone'o	ya	mïgï	mörö	kabïi	u'madï-zak	a'tai	sa'ne-ng	imbö	i'mo-zak	kaza	t-eji-zeng	mörö	ko,rabbit	Erg	Hes	that	moon	deplete-Perf	when	Emph-Style	soury.nut	split-Perf	like	Adv-be-Abs.Nzr	that	Emph,"Kone'o did, do you know how the moon looks at month end, it looks like a a soury nut that is cut in half",,,N	P	Prtcl	Dem	N	Vt	Prtcl	Prtcl	N	Vt	P	N	Dem	Prtcl	…,caesarDBakawaio,,np,
ra-kone-o-story-010,aka,möra'tai ji kaiguze a eboro mörö kone'o ji eboroiya,möra'tai	ji	kaiguji	ya	eboro	mörö	kone'o	ji	eboro-i-ya,at.that.time	Emph	jaguar	Erg	find	that	rabbit	Emph	find-3-Erg,At that time the tiger came along and found him doing this,,,Pro	Prtcl	N	P	Vt	Dem	N	Prtcl	Vt	…,caesarDBakawaio,,np,
ra-kone-o-story-015,aka,nai ji da'pï kaiguji ya möröng.... tuna sak enbödïiya,nai	ji	ta-'pï	kaiguji	ya	mörö-ng	tuna	sa'ne	ene-bödï-i-ya,where	Emph	say-Past	jaguar	Erg	A.I.?-Style	water	Emph	see-Hab-3-Erg,"Where is it the tiger asked, there.. he said while looking into the water",,what is *möröng*?,N	Prtcl	Vt	N	P	?-?	N	Prtcl	V-Asp-Prs-Agr	…,caesarDBakawaio,,n,
ra-kone-o-story-022,aka,möra'tai ji mïgï mörö kaiguji ya ji omba'pï gia'nö be imbö sa'ne ji öp.. öp.. haing... za,möra'tai	ji	mïgï	mörö	kaiguji	ya	ji	omba-'pï	gia'nö	pe	imbö	sa'ne	ji	öp	öp	haing	sa'ne,at.that.time	Emph	Hes	that	jaguar	Erg	Emph	taste-Past	tasty	like	soury.nut	Emph	Emph	surpise	surpise	drama	Emph,Then the tiger tasted the imbö nuts and they were very sweet,,*mörö kaiguji ya*,Pro	Prtcl	Prtcl	Dem	N	P	Prtcl	Vt	N	P	N	Prtcl	Prtcl	SW	SW	SW	Prtcl	…,caesarDBakawaio,,np_arg,
ra-kone-o-story-028,aka,"mörörö marö i'mobödïiya doh! i'moiya ning, ku i'moiya ning kïrö kone'o ya ganang",mörö-rö	marö	i'mo-bödï-i-ya	doh	i'mo-i-ya	ning	kuru	i'mo-i-ya	ning	kïrö	kone'o	ya	kanang,that-Emph	also	split-Iter-3-Erg	break	split-3-Erg	Emph	Emph	split-3-Erg	Emph	3Sg.Anim	rabbit	Erg	again,"He was again cracking/bursting up the same imbö nuts doh!(SSW), this was kone'o again cracking up these nuts",,*kïrö kone'o ya*,Dem	Interj	Vt	SW	Vt	Prtcl	Prtcl	Vt	Prtcl	Pro	N	P	Pro	…,caesarDBakawaio,,np_arg,
ra-kone-o-story-030,aka,e'tane kuru mïgï mörö kone'o a inggu'töbödï ji,e'tane	kuru	mïgï	mörö	kone'o	ya	inggu'tö-bödï	ji,but	Emph	Hes	that	rabbit	Erg	fool-Hab	Emph,But it was during this time that kone'o was making him a fool,,*mörö kone'o ya*,Prtcl	Prtcl	Prtcl	Dem	N	P	Vt	Prtcl	…,caesarDBakawaio,,np_arg,
ra-kone-o-story-035,aka,iwenairö genïk ji mörö diemu wenairö i'mobödïiya mörö doh!... doh! warau.. sebang sa'ne,i-wenai-rö	genïk	ji	mörö	i-emu	wenai-rö	i'mo-bödï-i-ya	mörö	doh	doh	warau	serö-be-ang	sa'ne,3-close.to-Emph	specifically	Emph	that	3-testicles	close.to-Emph	split-Iter-3-Erg	A.I.?	break	break	open	this-Attr-Nzr	Emph,"He was bursting up the nuts very close to his testicles doh! doh! warau! (it opened up) ""This is how it is done""",,*mörö diemu wenairö*.,Prs-P-Prtcl	Prtcl	Prtcl	Dem	N	P	Vt	?	SW	SW	SW	N	Prtcl	…,caesarDBakawaio,,np_arg,
ra-kone-o-story-047,aka,aanöuya zerö da'pï ji mïgï mörö iwarga bök chi kaiguze a aanöuya zerö,a-anö-u-ya	serö	ta-'pï	ji	mïgï	mörö	iwarga	pök	ji	kaiguji	ya	a-anö-u-ya	serö,2-eat.meat-1-Erg	S.I.	say-Past	Emph	Hes	that	monkey	to	Emph	jaguar	Erg	2-eat.meat-1-Erg	S.I.,"I am going to eat you said the tiger to the monkey, I am going to eat you",,*mörö iwarga pök*,Vt	Prtcl	Vt	Prtcl	Prtcl	Dem	N	P	Prtcl	N	P	Vt	Prtcl	…,caesarDBakawaio,,np_arg,
ra-kone-o-story-069,aka,möröbang ji se paga a'chijai'ya es'pï mörö wa,möröbang	ji	serö	paga	a'chi-zak-i-ya	eji-'pï	mörö	wa,thereafter	Emph	this	cow	hold-Perf-3-Erg	be-Past	A.I.?Erg,"Then he (kone'o) held on to one of the rock cows, he was there",,*se paga*,N	Prtcl	Pro	N	Vt	Vi	?	P	…,caesarDBakawaio,,np_arg,
ra-kone-o-story-071,aka,"nai awong anauya ta'pïya ji mörö, nai awong anauya",nai	yau-ng	anö	a-ya	ta-'pï-i-ya	ji	mörö	nai	yau-ng	anö	a-ya,what	Loc-Nzr	eat.meat	2-Erg	say-Past-3-Erg	Emph	A.I.?	what	Loc-Nzr	eat.meat	2-Erg,"where does the meat you are eating come from, he said",,another nominalized postposition,N	N	Vt	P	Vt	Prtcl	?	N	N	Vt	P	…,caesarDBakawaio,,n,
ra-kone-o-story-054,aka,pïuu!.... monggi sa'ji eno'maiya sa'ji,pïuu	monggi	sa'ne	ji	eno'ma-i-ya	sa'ne	ji,fly	monkey	Emph	Emph	throw-3-Erg	Emph	Emph,"Pïuu!(SSW,sound made by the monkey travelling through the air) he threw the poor monkey",,Good example of particles within VP,SW	N	Prtcl	Prtcl	Vt	Prtcl	Prtcl	…,caesarDBakawaio,,n,
ra-personal-narrative-061,aka,möra'tai ji serö kamrang,möra'tai	ji	serö	kamrang,at.that.time	Emph	this	Kamarang,Then this kamarang,,,Pro	Prtcl	Pro	N	…,caesarDBakawaio,,np,
ra-personal-narrative-062,aka,"ya'mu gau urö endu'pï ji mörö, San Rafeal ta na'nek airö kuru se kamrang u'madï yau",y-a'mu	kau	urö	endu-'pï	ji	mörö	ta	nai-nek	airö	kuru	serö	kamrang	u'madï	yau,3-source	in.water	1Sg	be.born-Past	Emph	A.I.?	say	3.be.Pres-Rel	near	Emph	this	Kamarang	finish	Loc,Within its source I was born in what is known as San Rafeal which is really within the source of the kamarang river,,"*u'madï* is nominalized *u'madï-*∅, the argument of *yau*. *serö* modifies either *kamrang* or *u'madï kamrang*.",N	P	Pro	Vi	Prtcl	?	Vt	Vi-Rel	P	Prtcl	Pro	N	Vt	P	…,caesarDBakawaio,,np_arg,
ra-personal-narrative-077,aka,mörö bada'pï yak elda Kaskarang ye'pï mörö sungwa ji nya e'tane sairö,mörö	pada-'pï	yak	elda	Kaskarang	yebï-'pï	mörö	sungwa	ji	nya	eji-dane	sairö,that	place-Past	into	Elder	Kaskarang	come-Past	that	far.away	Emph	1+3	be-while	here,Then to replace him elder Kaskarang came while we were somewhere around there,,,Dem	N	P	N	N	Vi	Dem	Adv	Prtcl	Pro	Vi	Adv	…,caesarDBakawaio,,np,
ra-personal-narrative-086,aka,kaiwak mörawong chi'kö aneruba,kaiwak	mörau-ng	ji'kö	aneruba,grasshopper.Sp	there-Nzr	from	grasshopper.Sp,kaiwak and aneruba,,1) another nominalized postposition 2) what does it mean?,N	N	P	N	…,caesarDBakawaio,,n,
ra-personal-narrative-091,aka,"kiawök ning tok ezek, mörö ning kaiwak ning idezektong kamoro",kiawök	ning	tok	ezek	mörö	ning	kaiwak	ning	i-ezek-dong	kamoro,akushy.ants	Emph	3Pl	name	that	Emph	grasshopper.Sp	Emph	3-name-Pl	3.Pl.Anim,"Those whose name is kiawok(akushy ants), those who are also known as kaiwak",,what is the structure of the second clause?,N	Prtcl	Pro	N	Dem	Prtcl	N	Prtcl	N	Pro	…,caesarDBakawaio,,?,
ra-personal-narrative-097,aka,"sungwarönggong dö mörö nine, ten ya'tai tok dö wiinai, tumong ya'tai ta mö serö ji tumong a'tai e'nö, june month ya'tai",sungwarö-ng-gong	tö	mörö	a'tai	tok	tö	wïinai	tumong	a'tai	ta	mörö	zerö	ji	tumong	a'tai	eji-nnö	a'tai,far.away-Nzr-Pl.Abs	go	A.I.?	when	3Pl	go	during.the.day	rainy.season	when	say	A.I.?	this	Emph	rainy.season	when	be-1+2S	while,"Those akushy ants over there would fly at nine, ten in the day, during the rainy season, we are now in the rainy season, it is June month",,*zerö ji tumang*,N	Vi	?	Prtcl	Pro	Vi	Pro	N	Prtcl	Vt	?	Pro	Prtcl	N	Prtcl	Vi	Prtcl	…,caesarDBakawaio,,part,
ra-personal-narrative-107,aka,"waro'ma, kamo ji binimï be ji nene'sang waro'ma, mörawong ji'kö wek.. wek... wek.. kek",waro'ma	kamoro	ji	pinimï	pe	y-eji	n-ene-zang	waro'ma	mörau-ng	ji'kö	wek	wek	wek	wek,frog.Sp	3.Pl.Anim	Emph	walk	like	3-be	O.Nzr-see-Pl.Nzr	frog.Sp	there-Nzr	from	Frog.sound	Frog.sound	Frog.sound	Frog.sound,"Those waro'ma frogs that I have seen while I was travelling, and those that say wek..wek..wek..kek",,*kamo* [...] *nene'sang waro'ma* are all coreferential. *nene’sang* has a first person zero,N	Pro	Prtcl	Vi	P	Vi	N	N	N	P	SW	SW	SW	SW	…,caesarDBakawaio,,y,
ra-personal-narrative-109,aka,"korowa'mi amök dieze'tong kamoro, a'tai hee.....",korowa'mi	amök	i-ezek-dong	kamoro	a'tai	hee,frog.Sp	Pl	3-name-Pl	3.Pl.Anim	yes	groan,"Those are called kora'mi, yes hee",,"""korowa'mis is their name them""?",N	Prtcl	N	Pro	Prtcl	SW	…,caesarDBakawaio,,?,
ra-personal-narrative-110,aka,mörö anö tok a mörö kagorgok amök ya mörö ji waiga amök pe rönamo ji,mörö	anö	tok	ya	mörö	Kako-gok	amök	ya	mörö	ji	wai'ka	amök	be	rönamo	ji,that	eat.meat	3Pl	Erg	that	Kako-tribe	Pl	Erg	that	Emph	Akawaio	Pl	like	uncrtn	Emph,The people from Kako (kagorgoks) eat those and maybe they do this as an Akawaio(wai'ka),,*mörö kagorgok amök ya*,Dem	Vt	Pro	P	Dem	N	Prtcl	P	Dem	Prtcl	N	Prtcl	P	Prtcl	Prtcl	…,caesarDBakawaio,,np_arg,
ra-personal-narrative-114,aka,"kamrang, kamrang taiya sa'ji, se kamrang ezek pe sa'ji se kamrang idezek kamrani ze",kamrang	kamrang	ta	i-ya	sa'ne	ji	serö	kamrang	ezek	be	sa'ne	ji	serö	kamrang	i-ezek	kamrani	serö,Kamarang	Kamarang	say	3-Erg	Emph	Emph	this	Kamarang	name	like	Emph	Emph	this	Kamarang	3-name	Kamarang	this,"It is referring to kamarang, it is the name of this kamarang, kamrani river",,what is going on with names and third person marking?,N	N	Vt	P	Prtcl	Prtcl	Pro	N	N	P	Prtcl	Prtcl	Pro	N	N	N	Pro	…,caesarDBakawaio,,?,
ra-personal-narrative-117,aka,kamrang be sa'ji se eji tuna ezek kamrang,kamrang	pe	sa'ne	ji	serö	eji	tuna	ezek	kamrang,Kamarang	like	Emph	Emph	this	be	water	name	Kamarang,This river is called Kamrang,,"Very likely two clauses, though interesting because of the absence of a comma.",N	P	Prtcl	Prtcl	Pro	Vi	N	N	N	…,caesarDBakawaio,,n,
ra-personal-narrative-123,aka,"kuguigok ta dok a mörö bök, tuna bök kuru um.. ïng!",ku'kui-gok	ta	tok	ya	mörö	pök	tuna	pök	kuru	um	ïng,Ku'kui-tribe	say	3Pl	Erg	that	from	water	from	Emph	um	mmm,"They say that is kukuigok(tribe from Kukui), because of the river",,nice example of afterthought in akawaio,N	Vt	Pro	P	Dem	P	N	P	Prtcl	SW	?	…,caesarDBakawaio,,n,
ra-personal-narrative-125,aka,"mörö wenai ji agawaio ta na'nek ji eji mörö ka'pong be ji tok a eza'sak mörö Akawaio ta dok a, kamranigok ta dok ya ji wijagong be",mörö	wenai	ji	Akawaio	ta	nai-nek	ji	y-eji	mörö	ka'pong	pe	ji	tok	ya	ezagï-zak	mörö	Akawaio	ta	tok	ya	kamrani-gok	ta	tok	ya	ji	wijagong	pe,that	because	Emph	Akawaio	say	3.be.Pres-Rel	Emph	3-be	that	person	like	Emph	3Pl	Erg	name-Perf	A.I.?	Akawaio	say	3Pl	Erg	Kamarang-tribe	say	3Pl	Erg	Emph	other	like,That is why the Akawaios are named in that way in the Amerindian way and they also called them kamranigok as the alternative way to call them,,,Dem	P	Prtcl	N	Vt	Vi-Rel	Prtcl	Vi	Dem	N	P	Prtcl	Pro	P	Vt	?	N	Vt	Pro	P	N	Vt	Pro	P	Prtcl	N	P	…,caesarDBakawaio,,np,
ra-personal-narrative-126,aka,kuguigok ta dok a anebra tuna ji eji mörö kugui be gwai ja'ne mörö kuguigok ta dok a,ku'kui-gok	ta	tok	ya	anebra	tuna	ji	eji	mörö	ku'kui	pe	u-ka-i	sa'ne	mörö	ku'kui-gok	ta	tok	ya,Ku'kui-tribe	say	3Pl	Erg	because	water	Emph	be	that	Ku'kui	like	1-say-RPst	Emph	that	Ku'kui-tribe	say	3Pl	Erg,They call them tribe from Kukui(kukuigok)because the river is kukui I say,,the second *mörö* may be A.I. or it may go with *kuguigok*,N	Vt	Pro	P	Pro	N	Prtcl	Vi	Dem	N	P	Vi	Prtcl	Dem	N	Vt	Pro	P	…,caesarDBakawaio,,?,
ra-personal-narrative-133,aka,yago da tok a rö kamoro maimu Agawaio amök sa'ji maimu,yagoro	ta	tok	ya	rö	kamoro	maimu	Akawaio	amök	sa'ne	ji	maimu,brother.in.law	say	3Pl	Erg	Emph	3.Pl.Anim	language	Akawaio	Pl	Emph	Emph	language,Or they will say 'yago' which is the word Akawaios use,,*kamoro* likely goes with *maimu*,N	Vt	Pro	P	Prtcl	Pro	N	N	Prtcl	Prtcl	Prtcl	N	…,caesarDBakawaio,,n,
ra-personal-narrative-136,aka,möröwenai maing kuru wagï bra rö ji damörö mörörö ji tugaik na'kö tok ya auro'kazak nai e'tane,mörö	wenai	maing	kuru	wagï	bra	rö	ji	tamö-rö	mörö-rö	ji	tugaik	na'kö	tok	ya	auro'ka-zak	nai	e'tane,that	because	word	Emph	good	Neg	Emph	Emph	you.know-Emph	that-Emph	Emph	like	maybe	3Pl	Erg	tell-Perf	3.be.Pres	but,"This is why there is really no good language, maybe they have also told you so, but",,,Dem	P	N	Prtcl	N	Adv	Prtcl	Prtcl	Prtcl	Dem	Prtcl	P	Adv	Pro	P	Vt	Vi	Prtcl	…,caesarDBakawaio,,part,
ra-personal-narrative-137,aka,mörö ning wiik e'tane egamauya mörö mörö yago're,mörö	ning	wiik	e'tane	egama-u-ya	mörö	mörö	yago're,that	Emph	while	however	tell-1-Erg	A.I.?	that	brother.in.law,"However, while this is so, I am telling you about yago're",,,Dem	Prtcl	Pro	Prtcl	Vt	?	Dem	N	…,caesarDBakawaio,,np,
ra-personal-narrative-138,aka,mörö yau rö yago're da dok a mörö turonggong ya rö mörau rö yago're ta dok ya rö tudombagong ezagï tok a,mörö	yau	rö	yago're	ta	tok	ya	mörö	turonnö-gong	ya	rö	mörau	rö	yago're	ta	tok	ya	rö	t-tomba-gong	ezagï	tok	ya,that	Loc	Emph	brother.in.law	say	3Pl	Erg	Fut	another-Pl	Erg	Emph	there	Emph	brother.in.law	say	3Pl	Erg	Emph	3.Rfl-relative-Pl.Psr	name	3Pl	Erg,"Within there some others would say yago're, this is how they would call their relative",,Interesting: *tok ya* and*turonnögong ya* are separated by postverbal *mörö*,Dem	P	Prtcl	N	Vt	Pro	P	Prtcl	N	P	Prtcl	Adv	Prtcl	N	Vt	Pro	P	Prtcl	N	Vt	Pro	P	…,caesarDBakawaio,,part,
ra-personal-narrative-154,aka,i'au biaruji ji mörö Sebel mörau biyau tok dösak egebe,i-'au	i-paruji	ji	mörö	Sebel	mörau	piyau	tok	tö-zak	ege-be,3-in.possession	3-younger.sister	Emph	that	Cebel	there	near.to	3Pl	go-Perf	big-Attr,"With him is his sister Cebel, they have gone there in great numbers",,,P	N	Prtcl	Dem	N	Adv	P	Pro	Vi	A	…,caesarDBakawaio,,np,
ra-personal-narrative-157,aka,iwangbe tok eji tok enubaning bra tugaik serö yau maing eji mörö maing,iwang-be	tok	eji	tok	enuba-ning	bra	tugaik	serö	yau	maing	eji	mörö	maing,hunger-Attr	3Pl	be	3Pl	teach-A.Nzr	Neg	like	this	Loc	word	be	that	word,There is word here that they are hungry and there is no one to teach them,,*serö yau maing* ‘at this word’,A	Pro	Vi	Pro	N	Adv	P	Pro	P	N	Vi	Dem	N	…,caesarDBakawaio,,posp,
ra-personal-narrative-166,aka,serau rï'kwörö nai aigorkwö wan e'ka mang serau kwö aigo,serau	rï'kwö-rö	nai	aigo	rï'kwö	wan	e'ka	mang	serau	rï'kwö	aigo,here	Dim-Emph	3.be.Pres	small	Dim	one	acres	3.be.Pres	here	Dim	small,"Here , there is only a small one, it is one acre",,*aigorkwö wan e'ka*,Adv	Adv?-Prtcl	Vi	N	Pro	Prtcl	N	Vi	Adv	Pro	N	…,caesarDBakawaio,,np,
ra-personal-narrative-190,aka,"pagira, pöinggö, urana, aku kamorö a kuru mïgï mörö egi yögu",pagira	pöinggö	urana	agu	kamoro-rö	ya	kuru	mïgï	mörö	egi	ögu,peccary	wild.hog	paca	agouti	3.Pl.Anim-Emph	Erg	Emph	Hes	that	cassava	eat.cassava,"The wild hog, the rodent urana, the aguti, these are the ones that eat the cassava",,*mörö egi ögu*,N	N	N	N	Pro	P	Prtcl	Prtcl	Dem	N	Vt	…,caesarDBakawaio,,np_arg,
ra-personal-narrative-193,aka,"serau ji tok eji mörö, kïrörörö urana a ögu mörö",serau	ji	tok	eji	mörö	kïrö-rö-rö	urana	ya	ögu	mörö,here	Emph	3Pl	be	A.I.?	3Sg.Anim-Emph-Emph	paca	Erg	eat.cassava	A.I.?,"Here, they have the rodent urana, he eat the cassava",,*kïrörörö urana ya*,Adv	Prtcl	Pro	Vi	?	Pro-Prtcl-Prtcl	N	P	Vt	?	…,caesarDBakawaio,,np_arg,
ra-personal-narrative-196,aka,möröwenai aza'rö mïgï te'seng urö imainarï,mörö	wenai	aza'rö	mïgï	t-eji-zeng	urö	i-maina-ri,that	because	two	Hes	Adv-be-Abs.Nzr	1Sg	3-farm-Psd,This is why I always have two farms,,how is the numeral related to the farms? Spike: 'Because of that my farms (are) being two.',Dem	P	Prtcl	Prtcl	N	Pro	N	…,caesarDBakawaio,,n,
ra-personal-narrative-200,aka,"serubö rö pömïi rö, pumpkin rubö rö pömïuya",serö	rubö	rö	pïmïi	rö	rubö	rö	pömï-u-ya,this	like	Emph	pepper	Emph	like	Emph	plant-1-Erg,Because I plant things like pepper and pumpkin,,what is the argument of *pömïuya*?,Pro	P	Prtcl	N	Prtcl	P	Prtcl	Vt	…,caesarDBakawaio,,?,
ra-personal-narrative-204,aka,pïzamo koroba bong warawok nongga'pïiya temari'ma dïbo rö,pïzamo	koroba	po-ng	warawok	nongga-'pï-i-ya	t-emari'ma	tïbo	rö,these.Anim	Koroba	Loc-Nzr	boy	leave-Past-3-Erg	3.Rfl-get.married	after	Emph,She left this man from Koroba after marrying him,,a four-word NP,Pro	N	N	N	Vt	Vi	Adv	Prtcl	…,caesarDBakawaio,,y,
ra-personal-narrative-208,aka,tri gaijarö imunggö amök ennaga'sak tugaik etauya,tri	gaijarö	mung-gö	amök	enna-gabï-zak	tugaik	eda-u-ya,three	in.number	nest-Imper	Pl	nose-Cmpltv-Perf	like	hear-1-Erg,I have heard that she has three children,,What is *enna*? (I’m pretty sure it’s not ‘nose’),Prtcl	Adv	N	Prtcl	N	P	Vt	…,caesarDBakawaio,,np_arg,
ra-personal-narrative-218,aka,udö ze Agast a'tai dö ze dabök kaji be rö gio'mamï Sintia mörau gio'mamï mörö,u-tö	serö	Agast	a'tai	tö	serö	ta-bök	kaji	pe	rö	i-ko'mamï	Sintia	mörau	i-ko'mamï	mörö,1-go	this	August	when	go	S.I.	say-Prog	lie	like	Emph	3-live	Cynthia	there	3-live	A.I.?,She keep saying she will be coming in August and this is a lie. That is Cyntia and that is how she is living,,,Vi	Pro	N	Prtcl	Vi	Prtcl	Vt	N	P	Prtcl	Vi	N	Adv	Vi	?	…,caesarDBakawaio,,np,
ra-personal-narrative-225,aka,möröwenai mïgï zerö pogoi bök eji,mörö	wenai	mïgï	serö	pogoi	pök	eji,that	because	Hes	this	sadness	from	be,That is why I am suffering from saddness,,*serö pogoi pök*,Dem	P	Prtcl	Pro	N	P	Vi	…,caesarDBakawaio,,np_arg,
ra-personal-narrative-238,aka,mörö mïgï biri'ning be ah... mïgï ya pasta ya diegare egama,mörö	mïgï	pirigï-ning	pe	ah	mïgï	ya	pasta	ya	i-egare	egama,that	Hes	add.more-A.Nzr	like	ah	this	Erg	Pastor	Erg	3-sermon	tell,To add to this (HES) the pastor preached a sermon,,*mïgï ya pasta ya*!,Dem	Prtcl	N	P	Interj	Pro	P	N	P	N	Vt	…,caesarDBakawaio,,np,
ra-personal-narrative-243,aka,serö rögeng jo'chi dak döngbök ejing... tok a'körö geng ji,serö	rögeng	jo'chi	tak	tö-nöbök	eji-ng	tok	a'körö	keng	ji,this	only	church	into	go-Prog	be-Style	3Pl	Instr	doubt	Emph,Only now I am going to church with them,,example of *serö* meaning 'now',Pro	Prtcl	N	P	Vi	Vi	Pro	P	Prtcl	Prtcl	…,caesarDBakawaio,,n,
ra-personal-narrative-246,aka,seröbe tri gaijarö mö agï'sau'ya mörö sungwa,serö-be	tri	gaijarö	mö	agïdï-zak-u-ya	mörö	sungwa,this-Attr	three	in.number	farm	cut-Perf-1-Erg	A.I.?	far.away,Presently I have cut down three farms over there,,*tri gaijarö mö*,A	Prtcl	Adv	N	Vt	?	Adv	…,caesarDBakawaio,,np_arg,
ra-personal-narrative-251,aka,"kane kïrö mïre aröuwa ba ganang dö ya'körö, janek mïre",kane	kïrö	mïre	arö-u-wa	pa	kanang	tö	y-a'körö	janek	mïre,no	3Sg.Anim	child	carry-1-Erg	grandchild	again	go	1-Assoc	Janet	child,"No, I am carrying my child, my grandchild is going with me, Janet's child",,*kïrö mïre aröuwa*,?	Pro	N	Vt	N	Pro	Vi	P	N	N	…,caesarDBakawaio,,np_arg,
ra-personal-narrative-262,aka,möröwenai ko'mamï dauya mö tigingnö biada bra go'mamï,mörö	wenai	ko'mamï	ta-u-ya	mörö	tiginnö	i-pada	bra	ko'mamï,that	because	live	say-1-Erg	A.I.?	one	3-place	Neg	live,That is why I live without one place of abode,,'without one place of abode',Dem	P	Vi	Vt	?	Prtcl	N	Adv	Vi	…,caesarDBakawaio,,np,
ra-personal-narrative-263,aka,möröwenai mörö ji köik amök go'mangbödï'pï sa'ne ji prarö ji tauya mö se au ji zemo'kazak ke,mörö	wenai	mörö	ji	köik	amök	ko'mamï-bödï-'pï	sa'ne	ji	bra-rö	y-eji	ta-u-ya	mörö	serö	yau	ji	semo'ka-zak	ke,that	because	that	Emph	old.man	Pl	live-Iter-Past	Emph	Emph	Neg-Emph	3-be	say-1-Erg	that	this	Loc	Emph	grow.up-Perf	Instr,"That is why I say that the old customs of the old men is non existent, because I grew up here",,,Dem	P	Dem	Prtcl	N	Prtcl	Vi	Prtcl	Prtcl	Prtcl	Vi	Vt	Dem	Pro	P	Prtcl	Vi	P	…,caesarDBakawaio,,np,
ra-personal-narrative-280,aka,"go'mannödok i'tuya bra rö jibök tauya mörö, mörö ning zemo'ka'pï au rögeng i'tuuya",ko'mamï-nö-dok	i'tu-u-ya	bra	rö	eji-bök	ta-u-ya	mörö	mörö	ning	semo'ka-'pï	yau	rögeng	i'tu-u-ya,live-Inf-Nzr	know-1-Erg	Neg	Emph	be-Prog	say-1-Erg	A.I.?	that	Emph	grow.up-Past	Loc	only	know-1-Erg,"I do not know the culture, I only know the one I grew up in",,*mörö ning zemo'ka'pï au* 'the one I grew up in' 1) nice long NP 2) what is the argument of 'know'? ,N	Vt	Adv	Prtcl	Vi	Vt	?	Dem	Prtcl	Vi	P	Prtcl	Vt	…,caesarDBakawaio,,np_arg,
ra-piya-ma-story-009,aka,"mïre amök mo'kabödï'pï iyaang, tri for gaijarö mïre amök arö iya.",mïre	amök	mo'ka-pödï-'pï	i-ya-ng	tri	for	gaijarö	mïre	amök	arö	i-ya,child	Pl	take.away-Iter-Past	3-Erg-Style	three	four	in.number	child	Pl	carry	3-Erg,"He use to take away the children, sometimes three and four in number, he will take them away",,*tri for gaijarö mïre amök*,N	Prtcl	Vt	Prs-P-?	Prtcl	Prtcl	Adv	N	Prtcl	Vt	P	…,caesarDBakawaio,,np_arg,
ra-piya-ma-story-021,aka, tu gaijaronggong es'pï mörö boisamök azak tok a ji piyai'ma a ji.,…	tu	gaijarö-ng-gong	eji-'pï	mörö	bois	amök	arö-zak	tok	ya	ji	piyai'ma	ya	ji,…	two	in.number-Nzr-Pl	be-Past	that	boys	Pl	carry-Perf	3Pl	Erg	Emph	giant	Erg	Emph,There were two boys who the piyai'ma had taken there,,"1) *tru gaijarongong es'pi mörö boisamök* with a V in between , 2) *tok a* and then *piyai'ma a*?",…	Prtcl	N	Vi	Dem	N	Prtcl	Vt	Pro	P	Prtcl	N	P	Prtcl	…,caesarDBakawaio,,y,
ra-piya-ma-story-023,aka,kayuni gak dö zerö konoik pök ta iya piyai'ma a tïno'pï bök.,kayuni	gak	tö	zerö	konoik	bök	ta	i-ya	piyai'ma	ya	tï-no'pï	bök,Kuyuni	into.liq	go	this	fishhook	WRT	say	3-Erg	giant	Erg	3Rfl-wife	to,I am going to the Kuyuni river to do some fishing' This is what piyai'ma said to his wife,,afterthought,N	P	Vi	Pro	N	P	Vt	P	N	P	N	P	…,caesarDBakawaio,,n,
ra-piya-ma-story-032,aka,"ö'rö, pïze a wöng möröwenai pöröu gonegazak tok a es'pï, tok pïre, pöröu.",ö'rö	pïze	ya	wönö	mörö	wenai	pöröu	gonega-zak	tok	ya	eji-'pï	tok	pïre	pöröu,what	this.Anim	Erg	kill	that	because	arrow	make-Perf	3Pl	Erg	be-Past	3Pl	arrow	arrow,"""What? this one will kill us!"" For this reason, they had made an arrow, their arrow, an arrow.",,is *pïze a wöng* a normal way of saying 'this one will kill us'?,N	Pro	P	Vt	Dem	P	N	Vt	Pro	P	Vi	Pro	N	N	…,caesarDBakawaio,,n,
ra-piya-ma-story-038,aka,ah. inggebra. inggebra woroik! tïbïre a'körö ji mörö mo'ka'pï kïrörö a mörö,ah	ingge	bra	ingge	bra	woroik	tï-pïre	a'körö	ji	mörö	mo'ka-'pï	kïrö-rö	ya	mörö,ah	slowly	Neg	slowly	Neg	take.out	3Rfl-arrow	Instr	Emph	that	take.out-Past	3Sg.Anim-Emph	Erg	A.I.?,she took out her arrow woroik!(SSW) and with it the charm,,Spike: [*tïbïre a'körö*] *ji* [[*mörö*] *mo’ka’pï*],Interj	Adv	Adv	Adv	Adv	SW	N	P	Prtcl	Dem	Vt	Pro	P	?	…,caesarDBakawaio,,n,
ra-piya-ma-story-041,aka,"möröbang ji mïgï mörö tïbïre a'körö se konegazai'ya es'pï, yöi bök diebu shi, sairong bök diebu shi",möröbang	ji	mïgï	mörö	tï-pïre	a'körö	se	konega-zak	i-ya	eji-'pï	yöi	bök	i-ebu	ji	sairong	bök	i-ebu	ji,thereafter	Emph	Hes	that	3Rfl-arrow	Instr	this	make-Perf	3-Erg	be-Past	stick	on	3-handle	Emph	around.here	on	3-handle	Emph,"Then she had made the charm that was placed onto a stick with a handle, it attached to the handle",,Spike: [[*mörö tïbïre*] *a'körö*] [*se konegazai'ya*] '[with [that arrow]] [she (had) made this]’,N	Prtcl	Prtcl	Dem	N	P	Dem	Vt	P	Vi	N	P	N	Prtcl	N	P	N	Prtcl	…,caesarDBakawaio,,np_arg,
ra-piya-ma-story-051,aka,"ege ji ka'pong amök kenïk kuibabö'tok au öinö es'pï mörö kuzang be, öinö",ege	ji	ka'pong	amök	kenïk	guibö-bödï-dok	yau	öinö	eji-'pï	mörö	kuzang	be	öinö,big	Emph	person	Pl	Purp	cook-Iter-Nzr	Loc	pot	be-Past	that	long	like	pot,Now there was an elongated pot there for cooking humans,,don’t know how to analyze this,N	Prtcl	N	Prtcl	P?	N	P	N	Vi	Dem	N	P	N	…,caesarDBakawaio,,?,
ra-piya-ma-story-055,aka,warawïdï'shi amök sa'ji moi a'tazak i'tuiya,warawïdï'shi	amök	sa'ne	ji	moi	a'ta-zak	i'tu	i-ya,boys	Pl	Emph	Emph	pubic.hair	grow-Perf	know	3-Erg,He was predicting that the boys pubic hair had grown,,good example of *amök sa'ne ji* within possessive NP,N	Prtcl	Prtcl	Prtcl	N	Vi	Vt	P	…,caesarDBakawaio,,n,
convwho-010,mak,Aakene... tumjune'da awa'deuwüdü e'nei iyö adödawö öuwö.,aakene	tumjune'da	a-w-a'deuwü-dü	e'nei	iyö	0-adö-dawö	a-uwö,como	fuertemente	2S-INTR-hablar-NZR.1	a_pesar_de	DEMin	3O-llevar-CONSEC	2-ERG,Este... de la misma manera que tu hablas duro cuando te la llevas (te llevas a alguien a la casa).,,,interr	ad	n	pp	pro	adv	posp	…,caceresDByekwana,,np,
convwho-012,mak,¡Aaa! möönü judumatommaane kaawede küüdüa yawö ¿möönü toonimmaane yawö?,aaa	möönü	judume-ato-mma-:ne	kaawede	k^-üdü-a	yaawö	möönü	tooni-mma-:ne	yaawö,ah	DEM3in	negro-NZR.5-EXCL-INTENS	cable	1+2/3-poner-NPST	entonces	DEM3in	uno-solamente-INTS	entonces,¡Ah! ¿sólo vamos a poner el cable negro?,,*möönü judumatommaane kaawede*,interj	pro	ad	n	v	ptc	pro	num-ptc-ptc	ptc	…,caceresDByekwana,,np,
convwho-028,mak,¿Chööwa'köto ka womjiiyu menejö amödö?,chö-wa'kö-ato	ka	womjiiyu	m-enejü-i	amödö,3-igual-NZR.5	QP	bombillo	2/3-traer-PRP	2s,¿ Trajiste bombillos que le sirven?,,,n	interr	n	v.t.	pro	…,caceresDByekwana,,part,
convwho-031,mak,Cuatroje tü womjiiyu nña nenejüdü na'janne ¿yööje'kene?,cuatro=je	tü	womjiiyu	nña	n-enejü-dü	n-a'ja-aanö-de	yööje-'kene,cuatro=ATRB	INTENS	bombillo	1+3	SHR-traer-NZR.1	3S-COP-PRI-INTENS	así-CONFIRM?,Trajimos cuatro bombillos ¿verdad?,,,adv	ad	ptc	n	pro	n	pers-v.i.a-TAM-suf.ad	adv	…,caceresDByekwana,,part,
convwho-051,mak,"Ekamma'jokö eduwa mö'dö, José eduwa.",0-ekamma'jo-kö	eduwa	mö'dö	José	eduwa,3O-preguntar-IMP	ahora	DEM1an	José	ahora,pregúntale a José ahora,,elaboration pattern,v.t.	ad	pro	n	ad	…,caceresDByekwana,,n,
